{
  "schema_version": "power-ringmin.small_n_interval_certificate.v1",
  "artifact_type": "small_n_interval_certificate",
  "problem": {
    "project": "power-ringmin",
    "radius_model": "quadratic",
    "dimension": 2,
    "constraints": {
      "central_external_tangency": true,
      "peripheral_pairwise_disjoint_interiors": true,
      "all_pairs_checked": true
    }
  },
  "instance": {
    "n": 3,
    "radius_sequence": {
      "kind": "explicit",
      "formula": "k^2",
      "index_base": 1,
      "indices": [
        1,
        2,
        3
      ],
      "radii": [
        1,
        4,
        9
      ]
    }
  },
  "order_space": {
    "order_type": "cyclic",
    "equivalence": "rotation_reflection",
    "canonicalization_rule": "largest_index_first_second_index_less_than_last",
    "expected_canonical_count": 1,
    "covered_canonical_count": 1,
    "coverage_rule": "exactly_one_verified_local_bracket_per_canonical_order"
  },
  "aggregation_method": {
    "local_verifier": "power_ringmin.interval_verifier.verify_fixed_order_interval_bracket",
    "order_space_source": "power_ringmin.search_small_n.canonical_index_orders",
    "lower_bound_rule": "minimum verified lower endpoint across canonical orders; monotonicity of fixed-order feasibility in R extends each local lower infeasibility certificate down to that endpoint",
    "upper_bound_rule": "minimum verified upper endpoint across canonical orders"
  },
  "result": {
    "global_lower_bound": {
      "radius_decimal": "0.3832870361393696523322205393924377858638763427734375",
      "encoding": "decimal_string",
      "included": false,
      "source_index_order": [
        3,
        1,
        2
      ]
    },
    "global_upper_bound": {
      "radius_decimal": "0.383487036139369685816546962087159045040607452392578125",
      "encoding": "decimal_string",
      "included": true,
      "source_index_order": [
        3,
        1,
        2
      ]
    },
    "statement": "For this finite n, the global optimum is bracketed between the strict lower endpoint and the feasible upper endpoint under the local interval-verifier semantics."
  },
  "local_bracket_summaries": [
    {
      "check_id": "LB-0001",
      "index_order": [
        3,
        1,
        2
      ],
      "radius_order": [
        9,
        1,
        4
      ],
      "lower_radius_decimal": "0.3832870361393696523322205393924377858638763427734375",
      "upper_radius_decimal": "0.383487036139369685816546962087159045040607452392578125",
      "lower_negative_cycle_sum_upper_decimal": "-0.0003457957018790924763607108616270124912261962890625",
      "min_upper_witness_slack_lower_decimal": "0.0000781249999999289457264239899814128875732421875",
      "result": "pass"
    }
  ],
  "local_brackets": [
    {
      "schema_version": "power-ringmin.fixed_order_interval_bracket.v1",
      "artifact_type": "fixed_order_interval_bracket",
      "index_order": [
        3,
        1,
        2
      ],
      "radius_order": [
        9,
        1,
        4
      ],
      "lower_radius_decimal": "0.3832870361393696523322205393924377858638763427734375",
      "upper_radius_decimal": "0.383487036139369685816546962087159045040607452392578125",
      "lower_certificate": {
        "kind": "negative_cycle",
        "cycle": [
          {
            "source": 1,
            "target": 0,
            "edge_kind": "forward_lower"
          },
          {
            "source": 0,
            "target": 2,
            "edge_kind": "wrap_upper"
          },
          {
            "source": 2,
            "target": 1,
            "edge_kind": "forward_lower"
          }
        ]
      },
      "upper_certificate": {
        "kind": "witness_positions",
        "positions_rad": [
          "0.0",
          "1.9678654309200840355487116539734415709972381591796875",
          "3.863575486189827490335346737992949783802032470703125"
        ]
      },
      "theta_interval_backend": {
        "backend": "mpmath_iv_guarded_atan2_v1",
        "precision_digits": 80,
        "rounding_policy": "mpmath.iv interval arithmetic; asin(x) evaluated as atan2(x, sqrt(1-x^2)); final endpoints widened by guard_decimal",
        "outward_enclosure": true,
        "certification_capable": true,
        "tolerance_based": false,
        "guard_decimal": "1e-70"
      },
      "min_upper_witness_slack_lower": "0.00003906249999996447286321199499070644378662109375",
      "lower_negative_cycle_sum_upper": "-0.00017289785093954623818035543081350624561309814453125",
      "generator": {
        "backend": "mpmath_highprec_proposal_with_interval_verifier_acceptance",
        "digits": 80,
        "radius_eta_decimal": "0.000100000000000000004792173602385929598312941379845142364501953125",
        "attempt": 1,
        "approximate_fixed_order_radius_decimal": "0.3833870361393696413188081351108849048614501953125",
        "verified": true,
        "claim_scope": "local_fixed_order_interval_bracket",
        "verification_summary": {
          "lower_negative_cycle_sum_upper_decimal": "-0.0003457957018790924763607108616270124912261962890625",
          "min_upper_witness_slack_lower_decimal": "0.0000781249999999289457264239899814128875732421875"
        }
      },
      "provenance": {
        "created_at_utc": "2026-07-11T00:00:00Z",
        "repository": {
          "name": "power-ringmin",
          "git_commit": "7f8e1d1b9eace8931502b0fb12db7925cdfe3434",
          "git_dirty": true
        },
        "software": [
          {
            "name": "Python",
            "version": "3.14.3",
            "role": "runtime"
          },
          {
            "name": "mpmath",
            "version": "1.3.0",
            "role": "high-precision and interval arithmetic"
          },
          {
            "name": "power-ringmin",
            "version": "0.1.0",
            "role": "fixed-order interval bracket exporter"
          }
        ],
        "source_files": [
          {
            "path": "src/power_ringmin/interval_bracket_exporter.py",
            "role": "fixed-order interval bracket generator/exporter"
          },
          {
            "path": "src/power_ringmin/interval_verifier.py",
            "role": "local fixed-order interval bracket verifier"
          },
          {
            "path": "src/power_ringmin/highprec.py",
            "role": "high-precision fixed-order STN proposal",
            "upstream_ringmin_commit": "cc0327400819fe06b230d967cdcbafffe1648317"
          }
        ],
        "commands": [
          {
            "command": "programmatic call: build_fixed_order_interval_bracket_record",
            "cwd": "C:\\Users\\Falker\\Desktop\\Code\\circle\\ringmin-squared",
            "result": "pass",
            "output_summary": "Built one n=3 fixed-order interval bracket record at 80 digits."
          }
        ],
        "randomness": {
          "used": false,
          "seeds": []
        }
      },
      "evidence": {
        "classification": "computer_certified_result",
        "claim": {
          "scope": "local_fixed_order_interval_bracket",
          "statement": "The local interval verifier accepted this fixed-order lower infeasibility and upper feasibility bracket. This is not a global small-n certificate."
        },
        "limitations": [
          "Finite fixed-order record only.",
          "No global cyclic-order optimality claim.",
          "No theorem for all n.",
          "Interval backend provenance remains a future production review item."
        ]
      }
    }
  ],
  "provenance": {
    "created_at_utc": "2026-07-11T00:00:00Z",
    "repository": {
      "name": "power-ringmin",
      "git_commit": "7f8e1d1b9eace8931502b0fb12db7925cdfe3434",
      "git_dirty": true
    },
    "software": [
      {
        "name": "Python",
        "version": "3.14.3",
        "role": "runtime"
      },
      {
        "name": "mpmath",
        "version": "1.3.0",
        "role": "interval arithmetic verification backend"
      },
      {
        "name": "power-ringmin",
        "version": "0.1.0",
        "role": "small-n interval certificate aggregator"
      }
    ],
    "source_files": [
      {
        "path": "src/power_ringmin/small_n_interval_certificate.py",
        "role": "finite small-n interval certificate aggregation"
      },
      {
        "path": "src/power_ringmin/search_small_n.py",
        "role": "canonical cyclic index-order regeneration"
      },
      {
        "path": "src/power_ringmin/interval_verifier.py",
        "role": "local fixed-order interval bracket verifier"
      },
      {
        "path": "src/power_ringmin/interval_bracket_exporter.py",
        "role": "n=3 fixture local bracket generator"
      },
      {
        "path": "src/power_ringmin/highprec.py",
        "role": "high-precision fixed-order STN proposal",
        "upstream_ringmin_commit": "cc0327400819fe06b230d967cdcbafffe1648317"
      }
    ],
    "commands": [
      {
        "command": "power-ringmin-export-n3-interval-certificate --output examples/small_n_interval_certificate_n3.json --digits 80 --guard-decimal 1e-70 --radius-eta 1e-4 --created-at-utc 2026-07-11T00:00:00Z",
        "cwd": "C:\\Users\\Falker\\Desktop\\Code\\circle\\ringmin-squared",
        "result": "pass",
        "output_summary": "Built finite n=3 interval certificate from 1 verified local bracket record(s)."
      }
    ],
    "randomness": {
      "used": false,
      "seeds": []
    }
  },
  "evidence": {
    "classification": "computer_certified_result",
    "claim": {
      "scope": "finite_global_small_n_interval_bracket",
      "statement": "This finite n=3 artifact verifies exactly one local fixed-order interval bracket for every canonical cyclic order and aggregates those brackets into a global finite-n radius bracket. It is not a theorem for all n."
    },
    "checks": [
      {
        "check_id": "EV-001",
        "classification": "verified_fact",